{
  "version": "0.1.1",
  "last_updated": "2026-08-05",
  "status": "proposed",
  "decision_id": "CC-DEC-035",
  "primary_medium": "living_website",
  "project_name": "The Constitutional Capitalism Project",
  "book_role": {
    "title": "Introduction to Constitutional Capitalism",
    "note": "The public book remains the readable entry. The website is the living school of thought."
  },
  "domain_tree": [
    {
      "node_id": "CC-WEB-PHILOSOPHY",
      "title": "The Philosophy",
      "status": "seeded"
    },
    {
      "node_id": "CC-WEB-CONSTITUTION",
      "title": "The Constitution",
      "status": "seeded"
    },
    {
      "node_id": "CC-WEB-FLOURISHING",
      "title": "Human Flourishing Index",
      "status": "seeded",
      "decision_id": "CC-DEC-072",
      "central_promise": "Did human life improve? Every proposal should answer whether it measurably increases human flourishing — not GDP alone.",
      "branches": [
        "Ultimate question",
        "Policy test",
        "Index domains",
        "Construction rules",
        "Childhood well-being link",
        "Civic participation link"
      ],
      "framework_file": "data/project/human_flourishing_index.json",
      "research_domain_title": "Human Flourishing Measurement"
    },
    {
      "node_id": "CC-WEB-FAMILY",
      "title": "Constitutional Family Doctrine",
      "status": "seeded",
      "decision_id": "CC-DEC-071",
      "related_decision_ids": [
        "CC-DEC-070"
      ],
      "central_promise": "Strong families create strong communities. Children are the republic's greatest long-term asset — with inherent dignity — and public institutions strengthen families rather than replace them whenever possible.",
      "branches": [
        "Children as greatest long-term asset",
        "Family-first care ladder",
        "Intergenerational prosperity",
        "No child should go hungry",
        "Children as infrastructure",
        "Child flourishing measurement",
        "Family Wealth System",
        "Constitutional promise to every child"
      ],
      "framework_file": "data/project/family_framework.json",
      "research_domain_title": "Family, Childhood Flourishing, and Intergenerational Prosperity"
    },
    {
      "node_id": "CC-WEB-ECONOMICS",
      "title": "Economics",
      "status": "seeded"
    },
    {
      "node_id": "CC-WEB-ASSISTANCE",
      "title": "Assistance Doctrine",
      "status": "seeded",
      "decision_id": "CC-DEC-074",
      "related_decision_ids": [
        "CC-DEC-073"
      ],
      "central_promise": "Guarantee security while dismantling dependency. Different pathways for different circumstances. Every additional hour of productive work should leave a household better off. Destination: income, ownership, and full community participation — not warehousing and not abandonment.",
      "iconic_phrase": "Automate the routine. Elevate the human.",
      "branches": [
        "Security vs dependency",
        "Six pathways",
        "Eliminate the benefit cliff",
        "Human Prosperity Account",
        "Prosperity Navigators",
        "Foundations of participation",
        "Community Work Guarantee",
        "Employer responsibility and asset-building",
        "Fair reciprocity and honest exits",
        "Prosperity and Participation Centers"
      ],
      "framework_file": "data/project/assistance_framework.json",
      "research_domain_title": "Assistance, Security, Participation, and Pathways to Independence"
    },
    {
      "node_id": "CC-WEB-FEDERALISM",
      "title": "Federalism Doctrine",
      "status": "seeded",
      "decision_id": "CC-DEC-080",
      "central_promise": "A federal government limited, capable, transparent, and focused — not weak. Power remains local unless national coordination, uniformity, or constitutional-rights protection is required.",
      "iconic_phrase": "Strong enough to protect the republic. Restrained enough to respect local self-government.",
      "branches": [
        "Constitutional rights",
        "Federalism",
        "National defense",
        "Immigration",
        "Interstate commerce",
        "Antitrust",
        "National finance and debt",
        "Infrastructure",
        "Public data",
        "Emergency powers",
        "Federal grants",
        "Agency review",
        "State sovereignty",
        "Local home rule",
        "National minimum standards",
        "Return of authority to lower levels"
      ],
      "framework_file": "data/project/federalism_framework.json",
      "research_domain_title": "Federal Role, Subsidiarity, and National Minimum Standards"
    },
    {
      "node_id": "CC-WEB-PEOPLES-BRANCH",
      "title": "Popular Sovereignty & People’s Branch",
      "status": "seeded",
      "decision_id": "CC-DEC-081",
      "central_promise": "The people are the continuing sovereign authority — a fourth branch and first source of authority — with structured powers to propose, reject, recall, audit, and amend, bounded by a hard rights floor and an accountable People’s Court.",
      "iconic_phrase": "Independent enough to protect rights. Accountable enough that abuse cannot hide behind independence.",
      "branches": [
        "The Sovereign People",
        "Citizen initiative",
        "Referendum and citizen veto",
        "Recall",
        "People’s Amendment Process",
        "Limited conventions",
        "Citizen audit",
        "Rights floor",
        "Supreme Court terms",
        "Judicial Accountability Council",
        "Ethics and recusal",
        "Emergency transparency",
        "Removal paths",
        "Constitutional dialogue",
        "State judicial standards",
        "Anti-wealth safeguards",
        "Citizens’ Deliberative Assembly",
        "The People’s Court"
      ],
      "framework_file": "data/project/popular_sovereignty_framework.json",
      "research_domain_title": "Popular Sovereignty, Direct Democracy, and Judicial Accountability"
    },
    {
      "node_id": "CC-WEB-EQUALITY",
      "title": "Equal Standing Before the Constitution",
      "status": "seeded",
      "decision_id": "CC-DEC-066",
      "related_decision_ids": [
        "CC-DEC-065"
      ],
      "central_promise": "Every person stands equal before the Constitution — equal protection and equal accountability. Conduct before status whenever constitutionally and practically possible. No one above the law; no one beneath its protection.",
      "iconic_phrase": "The Constitution should hear the evidence before it sees the person.",
      "branches": [
        "Foundational equal-standing principle",
        "Relevant distinctions vs illegitimate privilege",
        "Blind Stage Principle",
        "Equality of opportunity and accountability",
        "Reject privilege in every direction",
        "Equal Standing Test",
        "Equal access to justice",
        "Shared civic identity"
      ],
      "framework_file": "data/project/equal_standing_framework.json",
      "research_domain_title": "Equal Standing, Blind-Stage Justice, and Equal Access"
    },
    {
      "node_id": "CC-WEB-CITIZENSHIP",
      "title": "Constitutional Citizenship Doctrine",
      "status": "seeded",
      "decision_id": "CC-DEC-068",
      "related_decision_ids": [
        "CC-DEC-067",
        "CC-DEC-069"
      ],
      "central_promise": "Self-government requires education. Graduate every citizen prepared for responsible participation — democracy as a skill learned through experience, not merely a right activated by birthday. Civic service strengthens participation while remaining viewpoint-neutral.",
      "branches": [
        "Self-government requires education",
        "Preparation over age-alone framing",
        "Participatory elementary civics",
        "Developmental civic pathway",
        "Youth Leadership Councils",
        "Prepared participation pilots",
        "Civic Graduation and Citizenship Portfolio",
        "Schools as community laboratories",
        "Viewpoint-neutral civic service",
        "Civic Service Portfolio",
        "Optional safeguarded political participation",
        "Civic Achievement Transcript",
        "Civic service and experience scorecards"
      ],
      "framework_file": "data/project/constitutional_citizenship_framework.json",
      "research_domain_title": "Civic Preparation, Youth Participation, and Constitutional Citizenship"
    },
    {
      "node_id": "CC-WEB-JUSTICE",
      "title": "Community Safety, Justice, and Restoration",
      "status": "seeded",
      "decision_id": "CC-DEC-044",
      "related_decision_ids": [
        "CC-DEC-058",
        "CC-DEC-059"
      ],
      "central_promise": "Not more incarceration, not less accountability — more safety, more restoration, and far less human potential permanently discarded. Never classify people as unworthy of reentry; when continuing extreme danger requires custody, use public, humane, reviewable secure campuses — not exile or private profit from confinement.",
      "branches": [
        "Constitutional rights",
        "Community Safety Corps",
        "Policing and public safety",
        "Behavioral-health response",
        "Victim services",
        "Courts and due process",
        "Prosecution",
        "Public defense",
        "Decision pathways",
        "Sentencing",
        "Public corrections",
        "Secure restoration campuses",
        "Secure Public Safety Campuses",
        "Permanent Public Safety System",
        "Mental health and addiction",
        "Youth justice",
        "Restorative justice",
        "Reentry from day one",
        "Restoration Councils",
        "Transparency and civilian review",
        "Civil justice",
        "White-collar and institutional wrongdoing",
        "Fines, fees, and forfeiture",
        "Data, testing, and public accountability"
      ],
      "framework_file": "data/project/justice_framework.json"
    },
    {
      "node_id": "CC-WEB-GOVERNMENT",